Action,BaseSKU,BaseProductName,BaseUnitsOfMeasure,AdditionalUnitsOfMeasureSKU,AdditionalUnitsOfMeasureProductName,AdditionalUnitsOfMeasureName,NumberOfBaseUnitsInAdditionalUnit,IAmSellingThisProduct
"","10303","12 Pack 4 Oz Dough","Unit","10303-Case Pack 6","12 Pack 4 Oz Dough-Casepack 6","Case Pack 6",6.0000000000,True,
"","10408","10pk Kiddy Dough","Unit","10408-Case Pack 6","10pk Kiddy Dough-Case Pack 6","Case Pack 6",6.0000000000,True,
"","12816","Make your own water candel","Unit","12816-Case Pack 6","Make your own water candel-Case Pack 6","Case Pack 6",1.0000000000,True,
"","12992","Candle Making Set","Unit","12992-Case Pack 6","Candle Making Set-Case Pack 6","Case Pack 6",1.0000000000,True,
"","1507","Snow Paper Snowflake Garland Kit - Make 8ft Fluffy Snowflake","Unit","1507-Case Pack 12","Snow Paper Snowflake Garland Kit - Make 8ft Fluffy Snowflake-Case Pack 12","Case Pack 12",12.0000000000,True,
"","1508","Snow Paper Winter Decorations - Make 13 Snow-Covered Ornaments","Unit","1508-Case Pack 12","Snow Paper Winter Decorations - Make 13 Snow-Covered Ornaments-Case Pack 12","Case Pack 12",12.0000000000,True,
"","164266","Slap Bracelet (18657)","Unit","164266-Case Pack 24","Slap Bracelet (18657)-Case Pack 24","Case Pack 24",24.0000000000,True,
"","17489","MAGIC BOUNCING BALLS KIT","Unit","17489-Case Pack 12","MAGIC BOUNCING BALLS KIT-Case Pack 12","Case Pack 12",12.0000000000,True,
"","226","TMNT Stretch Sand","Case Pack 6","226-Case Pack 6","TMNT Stretch Sand-Casepack 6","Unit",6.0000000000,True,
"","88349","Licensed Stamp Stars","Unit","230","TMNT DOUGH TOPPER 3OZ","Unit",18.0000000000,True,
"","2331","INTERACTIVE HUMAN BODY","Unit","2331-Case Pack 4","Be Amazing! Toys Interactive Human Body Fully Poseable Anatomy Figure – 14” Tall-Casepack 4","Case Pack 4",4.0000000000,True,
"","2331F","Our Amazing Human Body Science Activity Kit","Unit","2331F-Case Pack 4","Our Amazing Human Body Science Activity Kit-Case Pack 4","Case Pack 4",4.0000000000,True,
"","2332","LAB IN A BAG: GLOW IN THE DARK","Unit","2332-Case Pack 6","LAB IN A BAG: GLOW IN THE DARK-Case Pack 6","Case Pack 6",6.0000000000,True,
"","2335","SUPER SQUISHY SCIENCE LAB","Unit","2335-Case Pack 6","Be Amazing! Toys Super Squishy Science Lab - Make Your Own Slime Kit-Casepack 6","Case Pack 6",6.0000000000,True,
"","2337","BIG BAG OF BACKYARD SCIENCE","Unit","2337-Case Pack 6","BIG BAG OF BACKYARD SCIENCE-Case Pack 6","Case Pack 6",6.0000000000,True,
"","2338","Be Amazing! Toys Weather Science Lab Kit with 20 Projects","Unit","2338-Case Pack 6","Be Amazing! Toys Weather Science Lab Kit with 20 Projects-Casepack 6","Case Pack 6",6.0000000000,True,
"","2351","LAB IN A BAG: GEARS & GADGETS","Unit","2351-Case Pack 18","LAB IN A BAG: GEARS & GADGETS-Case Pack 18","Case Pack 18",18.0000000000,True,
"","2351","LAB IN A BAG: GEARS & GADGETS","Unit","2351-Case Pack 4","LAB IN A BAG: GEARS & GADGETS-Case Pack 4","Case Pack 4",4.0000000000,True,
"","2351","LAB IN A BAG: GEARS & GADGETS","Unit","2351-Case Pack 6","LAB IN A BAG: GEARS & GADGETS-Case Pack 6","Case Pack 6",6.0000000000,True,
"","2361","MEGA LAB","Unit","2361-Case Pack 6","Be Amazing! Toys MEGA Science Lab - Over 30 Activities-Casepack 6","Case Pack 6",6.0000000000,True,
"","2362","SURVIVAL SCIENCE","Unit","2362-Case Pack 6","Be Amazing! Toys Survival Science Lab - Survival Kit for Kids-Casepack 6","Case Pack 6",1.0000000000,True,
"","2363","MYSTERIOUS MATTER","Unit","2363-Case Pack 6","MYSTERIOUS MATTER-Case Pack 6","Case Pack 6",6.0000000000,True,
"","2400SPS","Snow Pets Mystery Pet!","Unit","2400SPS-Case Pack 18","Snow Pets Mystery Pet!-Case Pack 18","Case Pack 18",18.0000000000,True,
"","2402","SNOW PETS SERIES 2","Unit","2402-Case Pack 18 PDQ","SNOW PETS SERIES 2-Case Pack 18 PDQ","Case Pack 18 PDQ",18.0000000000,True,
"","254","TMNTDoodleDeskAsst","Unit","254-Case Pack 6","TMNTDoodleDeskAsst-Case Pack 6","Case Pack 6",6.0000000000,True,
"","2615","EGG-CELLENT EXPERIMENTS","Unit","2615-Case Pack 8","Science to The Max Egg-Cellent Experiment - 6 Pack Science Experiments for Children-Case Pack 8","Case Pack 8",1.0000000000,True,
"","30873","Play Tefillin","Unit","30873-Case Pack 12","Play Tefillin-Case Pack 12","Case Pack 12",1.0000000000,True,
"","3211","License Nick PYO Rock-Dora","Unit","3211-Case Pack 6","License Nick PYO Rock-Dora-Case Pack 6","Case Pack 6",6.0000000000,True,
"","35009","SPIN & SPLATTER","Unit","35009-Case Pack 4","Spin & Splatter-Case Pack 4","Case Pack 4",4.0000000000,True,
"","35009","SPIN & SPLATTER","Unit","35009-Case Pack 6","Spin & Splatter-Casepack 6","Case Pack 6",6.0000000000,True,
"","4120","STTM Big Bag of Science","Unit","4120-Case Pack 6","STTM Big Bag of Science-Case Pack 6","Case Pack 6",1.0000000000,True,
"","4420","TEST TUBE ADVENTURES","Unit","4420-Case Pack 6","Lab in a Bag Test Tube Adventures Science toys for Kids 8+-Casepack 6","Case Pack 6",1.0000000000,True,
"","4531","COCO MELON WOODEN PUZZLE BEACH","Unit","4531-Case Pack 12","COCO MELON WOODEN PUZZLE BEACH-Case Pack 12","Case Pack 12",12.0000000000,True,
"","4531","COCO MELON WOODEN PUZZLE BEACH","Unit","4531-Case Pack 12 PDQ","CoComelon Wood Puzzle - School-Casepack 12 PDQ","Case Pack 12 PDQ",12.0000000000,True,
"","4532","COCO  MELON PUZZLE FRIENDS","Unit","4532-Case Pack 12 PDQ","COCO  MELON PUZZLE FRIENDS-Case Pack 12 PDQ","Case Pack 12 PDQ",12.0000000000,True,
"","4533","WOODEN PUZZLE BEDTIME","Unit","4533-Case Pack 12 PDQ","WOODEN PUZZLE BEDTIME-Case Pack 12 PDQ","Case Pack 12 PDQ",12.0000000000,True,
"","4533","WOODEN PUZZLE BEDTIME","Unit","4533-Case Pack 6 PDQ","Cocomelon Wooden Puzzle - Bedtime-Casepack 6 PDQ","Case Pack 6 PDQ",1.0000000000,True,
"","4533","WOODEN PUZZLE BEDTIME","Unit","4533-DELETE 12, Inner 6 PDQ","Cocomelon Wooden Puzzle - Bedtime-Case Pack 12, Inner 6 PDQ","Case Pack 12, Inner 6 PDQ",12.0000000000,True,
"","4535","COCO MELON PUZZLE NUMBERS","Unit","4535-Case Pack 12","COCO MELON PUZZLE NUMBERS-Case Pack 12","Case Pack 12",12.0000000000,True,
"","4537","COCO MELON WOODEN PUZZLE ANIMAL FRIENDS","Unit","4537-Case Pack 12","COCO MELON WOODEN PUZZLE ANIMAL FRIENDS-Case Pack 12","Case Pack 12",12.0000000000,True,
"","4539","COCO MELON DOUGH SET","Unit","4539-Case Pack 6","Cocomelon Wooden Puzzle Animal Friends For Kids 2+-Casepack 6","Case Pack 6",1.0000000000,True,
"","4550","Cocomelon Water Reveal Art","Unit","4550-Case Pack 24","Cocomelon Water Reveal Art-Case Pack 24","Case Pack 24",24.0000000000,True,
"","4551","Water Reveal Art","Unit","4551-Case Pack 24","Water Reveal Art-Case Pack 24","Case Pack 24",24.0000000000,True,
"","4552","Water Reveal Art","Unit","4552-Case Pack 24","Water Reveal Art-Case Pack 24","Case Pack 24",24.0000000000,True,
"","4564","COCO MELON BACK PACK","Unit","4564-Case Pack 12","COCO MELON BACK PACK-Case Pack 12","Case Pack 12",12.0000000000,True,
"","4564","COCO MELON BACK PACK","Unit","4564-Case Pack 6","COCO MELON BACK PACK-Case Pack 6","Case Pack 6",6.0000000000,True,
"","4599","Puffy Paint Window Cling","Unit","4599-Case Pack 6","Puffy Paint Window Cling-Case Pack 6","Case Pack 6",6.0000000000,True,
"","4606","COCO MELON MY OWN STAMP SET","Unit","4606-Case Pack 6","Cocomelon My Own Stamp Set-Casepack 6","Case Pack 6",6.0000000000,True,
"","4614","COCO MELON DELUXE BATH ART PARTY","Unit","4614-Case Pack 6","COCO MELON DELUXE BATH ART PARTY-Case Pack 6","Case Pack 6",6.0000000000,True,
"","4616","Bath Art Set","Unit","4616-Case Pack 6","Bath Art Set-Case Pack 6","Case Pack 6",6.0000000000,True,
"","4637","CoComelon Window Art","Unit","4637-Case Pack 6","CoComelon Window Art-Case Pack 6","Case Pack 6",6.0000000000,True,
"","4662","COCO MELON ACTIVITY CASE","Unit","4662-Case Pack 6","Cocomelon Deluxe Craft Pack-Casepack 6","Case Pack 6",6.0000000000,True,
"","4663","WHEELS ON THE BUS MOLD SET","Unit","4663-Case Pack 6","WHEELS ON THE BUS MOLD SET-Case Pack 6","Case Pack 6",6.0000000000,True,
"","4705","PYO Bank Cocomelon","Unit","4705-Case Pack 6","PYO Bank Cocomelon-Case Pack 6","Case Pack 6",6.0000000000,True,
"","4733","Sculpt and Mold Dough Kit-Case Pack 24","Case Pack 24","4733-Case Pack 24","Sculpt and Mold Dough Kit-Case Pack 24-Case Pack 24","Case Pack 24",1.0000000000,True,
"","5557","Spongebob Sand Set","Case Pack 6","5557-Case Pack 6","Spongebob Sand Set-Casepack 6","Unit",6.0000000000,True,
"","5567","License Nick PYO Rock-TMNT","Unit","5567-Case Pack 6","License Nick PYO Rock-TMNT-Case Pack 6","Case Pack 6",6.0000000000,True,
"","60004","Glitter Gush Balls","Unit","60004-Case Pack 6","Glitter Gush Balls-Case Pack 6","Case Pack 6",6.0000000000,True,
"","60041","MY SECRETS DIARY-DRAGON","Unit","60041-Case Pack 12","MY SECRETS DIARY-DRAGON-Case Pack 12","Case Pack 12",12.0000000000,True,
"","60054","MY SECRET DIARY - UNICORN","Unit","60054-Case Pack 6","MY SECRET DIARY - UNICORN-Case Pack 6","Case Pack 6",1.0000000000,True,
"","60186","FUNKY PILLOW MAKER - NARWAHL","Unit","60186-Case Pack 6","FUNKY PILLOW MAKER - NARWAHL-Case Pack 6","Case Pack 6",6.0000000000,True,
"","60211","Zzand Dino Island","Unit","60211-Case Pack 6","Zzand Dino Island-Case Pack 6","Case Pack 6",6.0000000000,True,
"","60243","Latch and Hook Fun","Unit","60243-Case Pack 6","Latch and Hook Fun-Case Pack 6","Case Pack 6",6.0000000000,True,
"","60483","Stepping Stone","Unit","60483-Case Pack 4","Stepping Stone-Case Pack 4","Case Pack 4",4.0000000000,True,
"","60493","SCOOPS AND POPS PARLOR","Unit","60493-Case Pack 6","Scoops & Pops Parlor-Case Pack 6","Case Pack 6",6.0000000000,True,
"","60494","KIDDY DOUGH PICNIC BASKET","Unit","60494-Case Pack 6","KIDDY DOUGH PICNIC BASKET-Case Pack 6","Case Pack 6",6.0000000000,True,
"","60919","DINOSOUR & PRINCESS SPRAY & STAY MAGIC BEADS","Unit","60919-Case Pack 6","DINOSOUR & PRINCESS SPRAY & STAY MAGIC BEADS-Case Pack 6","Case Pack 6",6.0000000000,True,
"","60921","Stretch Sand Blue","Unit","60921-Case Pack 6","Stretch Sand Blue-Case Pack 6","Case Pack 6",6.0000000000,True,
"","60922","Stretch Sand Pink","Unit","60922-Case Pack 6","Stretch Sand Pink-Casepack 6","Case Pack 6",6.0000000000,True,
"","60995","PULL ALONG SENSORY BOX","Unit","60995-Case Pack 4","Sensory Pull Along Toddler Infant Baby Tissue Box-Casepack 4","Case Pack 4",1.0000000000,True,
"","6110","Blippi Colors","Unit","6110-Case Pack 6","Blippi My First Science: Science Kit with Color Experiments-Casepack 6","Case Pack 6",6.0000000000,True,
"","6112","BLIPPI SINK OR FLOAT","Unit","6112-Case Pack 6","Blippi My First Science: Sink or Float - Science Kit with Physics Experiments 3+-Casepack 6","Case Pack 6",6.0000000000,True,
"","6114","BLIPPI THE 5 SENSES","Unit","6114-Case Pack 6","Blippi Science Kit for Kids - 5 Experiments and STEM Activities with Scented Dough-Casepack 6","Case Pack 6",6.0000000000,True,
"","61187","12 Pcs Chalk bucket","Unit","61187-Case Pack 12","Creative Kids Premium Sidewalk Chalk Bulk Class Pack - Chalk for Boys & Girl - Includes 12 Reusable Chalk Containers - Total 144 PCS Chalk Set-Case Pack 12","Case Pack 12",1.0000000000,True,
"","61187","12 Pcs Chalk bucket","Unit","61187-Case Pack 12, Inner 4","12 Pcs Chalk bucket-Case Pack 12, Inner 4","Case Pack 12, Inner 4",1.0000000000,True,
"","6120","CCM COLOR COUNTING AND FUN","Unit","6120-Case Pack 6","Cocomelon Color Science Kit - 5 Kids Science Experiments-Casepack 6","Case Pack 6",6.0000000000,True,
"","6122","COCO MELON BALANCING STACKROBATS","Unit","6122-Case Pack 24","COCO MELON BALANCING STACKROBATS-Case Pack 24","Case Pack 24",24.0000000000,True,
"","61369","Sense & Grow Sensory Sand Activity Kit - Sand Bin with 6 Farm Animal Figurines","Unit","61369-Case Pack 4","Sense & Grow Sensory Sand Activity Kit - Sand Bin with 6 Farm Animal Figurines-Case Pack 4","Case Pack 4",4.0000000000,True,
"","61370","Sense & Grow Sensory Bin - Sea Life Slime Activity Kit with 6 Sea Animal Figurines","Unit","61370-Case Pack 4","Sense & Grow Sensory Bin - Sea Life Slime Activity Kit with 6 Sea Animal Figurines-Case Pack 4","Case Pack 4",4.0000000000,True,
"","61372","SENSE AND GROW FIDGET CASE","Unit","61372-Case Pack 4","SENSE AND GROW FIDGET CASE-Case Pack 4","Case Pack 4",4.0000000000,True,
"","61373","SUPRISE SAND DIG-UPS","Unit","61373-Case Pack 6","SUPRISE SAND DIG-UPS-Case Pack 6","Case Pack 6",6.0000000000,True,
"","61374","Bean Bag Suprise","Unit","61374-Case Pack 6","Bean Bag Suprise-Case Pack 6","Case Pack 6",6.0000000000,True,
"","61374","Bean Bag Suprise","Unit","61374-Case Pack 6, Inner 2","Bean Bag Suprise-Case Pack 6, Inner 2","Case Pack 6, Inner 2",6.0000000000,True,
"","61375","DRY ERASE GAME","Unit","61375-Case Pack 6","DRY ERASE GAME-Case Pack 6","Case Pack 6",6.0000000000,True,
"","61376","LIQUID TIMER","Unit","61376-Case Pack 12","LIQUID TIMER-Case Pack 12","Case Pack 12",12.0000000000,True,
"","61377","Sense & Grow 4 Stress Relief Balls for Kids & Adults 4 Textured Balls","Unit","61377-Case Pack 24, Inner 6","Sense & Grow 4 Stress Relief Balls for Kids & Adults 4 Textured Balls-Case Pack 24, Inner 6","Case Pack 24, Inner 6",24.0000000000,True,
"","61377","Sense & Grow 4 Stress Relief Balls for Kids & Adults 4 Textured Balls","Unit","61377-Case Pack 6","Sense & Grow 4 Stress Relief Balls for Kids & Adults 4 Textured Balls-Case Pack 6","Case Pack 6",6.0000000000,True,
"","61378","SENSEORY STICKERS","Unit","61378-Case Pack 24","SENSEORY STICKERS-Case Pack 24","Case Pack 24",24.0000000000,True,
"","61378","SENSEORY STICKERS","Unit","61378-Case Pack 6","SENSEORY STICKERS-Case Pack 6","Case Pack 6",6.0000000000,True,
"","61379","MAGNETIC TEXTURED TANGRAM PUZZLES","Unit","61379-Case Pack 6","Sense & Grow Magnetic Textured Tangram Puzzles-Casepack 6","Case Pack 6",1.0000000000,True,
"","61381","Textured Stretch Noodles","Unit","61381-Case Pack 24","Textured Stretch Noodles-Case Pack 24","Case Pack 24",24.0000000000,True,
"","61381","Textured Stretch Noodles","Unit","61381-Case Pack 6","Sense And Grow Stretch Noodle-Casepack 6","Case Pack 6",6.0000000000,True,
"","61382-B","Sense & Grow - Tissue Box (Qty 6 Type B Box)","Unit","61382-Case Pack 6","Sense & Grow - Tissue Box-Casepack 6","Case Pack 6",6.0000000000,True,
"","61383","Sensory Stretch Pop Tubes/24pcs","Unit","61383-Case Pack 6","Sense & Grow Sensory Stretch Pop Tubes-Casepack 6","Case Pack 6",1.0000000000,True,
"","61403","10 PACK OF ZZAND","Unit","61403-Case Pack 10","10 PACK OF ZZAND-Case Pack 10","Case Pack 10",10.0000000000,True,
"","61655","Body Art Super Set","Unit","61655-Case Pack 6","Body Art Super Set-Case Pack 6","Case Pack 6",6.0000000000,True,
"","61658","SENSORY FLASH CARDS","Unit","61658-Case Pack 6","SENSORY FLASH CARDS-Case Pack 6","Case Pack 6",6.0000000000,True,
"","61659","TEXTURED DOUGH ROLLER","Unit","61659-Case Pack 6","TEXTURED DOUGH ROLLER-Case Pack 6","Case Pack 6",6.0000000000,True,
"","61805","LITTLE FARMER WOOD PLAY SET","Unit","61805-Case Pack 6","LITTLE FARMER WOOD PLAY SET-Case Pack 6","Case Pack 6",6.0000000000,True,
"","61806","LLAMA CERMAIC COIN BANK","Unit","61806-Case Pack 6","LLAMA CERMAIC COIN BANK-Case Pack 6","Case Pack 6",6.0000000000,True,
"","61807","Uni Kitty Cermaic Coin Bank","Unit","61807-Case Pack 6","Uni Kitty Cermaic Coin Bank-Case Pack 6","Case Pack 6",6.0000000000,True,
"","61820","Sensory Stretch Pop Tubes","Unit","61820-Case Pack 24","Sensory Stretch Pop Tubes-Case Pack 24","Case Pack 24",24.0000000000,True,
"","61933","Dino Fun Set","Unit","61933-Case Pack 6","Dino Fun Set-Case Pack 6","Case Pack 6",6.0000000000,True,
"","61948","Glitter Tattoo Set","Unit","61948-Case Pack 6","Glitter Tattoo Set-Casepack 6","Case Pack 6",6.0000000000,True,
"","62033","RESIN BRACELETS KIT","Unit","62033-Case Pack 6","RESIN BRACELETS KIT-Case Pack 6","Case Pack 6",6.0000000000,True,
"","62034","RESIN EARRING KIT","Unit","62034-Case Pack 6","RESIN EARRING KIT-Case Pack 6","Case Pack 6",6.0000000000,True,
"","62035","RESIN RING KIT","Unit","62035-Case Pack 6","DIY Resin Rings by Craft it Up- 10+ Piece Beginners Kit-Casepack 6","Case Pack 6",1.0000000000,True,
"","62036","RESIN NECKLACES KIT","Unit","62036-Case Pack 6","CIU DIY RESIN NECKLACES-Casepack 6","Case Pack 6",1.0000000000,True,
"","62294","CK WATER ART SPACE","Unit","62294-Case Pack 24, Inner 6","Creative Kids Water Art - Space-Casepack 24, Inner 6","Case Pack 24, Inner 6",24.0000000000,True,
"","62295","Creative Kids Water Art - Princesses","Unit","62295-Case Pack 24, Inner 6","Creative Kids Water Art - Princesses-Case Pack 24, Inner 6","Case Pack 24, Inner 6",24.0000000000,True,
"","62296","CK WATER ART DRAGON","Unit","62296-Case Pack 24, Inner 6","Creative Kids Water Art - Dragon-Casepack 24, Inner 6","Case Pack 24, Inner 6",24.0000000000,True,
"","62297","CK WATER ART CONSTRUCTION","Unit","62297-Case Pack 12","CK WATER ART CONSTRUCTION-Case Pack 12","Case Pack 12",1.0000000000,True,
"","62297","CK WATER ART CONSTRUCTION","Unit","62297-Case Pack 24, Inner 6","Creative Kids Water Art - Construction-Case Pack 24, Inner 6","Case Pack 24, Inner 6",24.0000000000,True,
"","62298","Creative Kids Water Art - Farm","Unit","62298-Case Pack 24, Inner 6","Creative Kids Water Art - Farm-Casepack 24, Inner 6","Case Pack 24, Inner 6",24.0000000000,True,
"","62299","Creative Kids Water Art - Construction","Unit","62299-Case Pack 24, Inner 6","Creative Kids Water Art - Construction-Case Pack 24, Inner 6","Case Pack 24, Inner 6",24.0000000000,True,
"","62318","AROMATHERAPY SPA DOUGH","Unit","62318-Case Pack 36","AROMATHERAPY SPA DOUGH-Case Pack 36","Case Pack 36",36.0000000000,True,
"","62318","AROMATHERAPY SPA DOUGH","Unit","62318-Case Pack 8","AROMATHERAPY SPA DOUGH-Case Pack 8","Case Pack 8",8.0000000000,True,
"","62325","Miracle-Gro DIY Tranquil Zen Garden","Unit","62325-Case Pack 6","Miracle-Gro DIY Tranquil Zen Garden-Casepack 6","Case Pack 6",6.0000000000,True,
"","62437/62438","Creative Kids Sand Art Asst","Unit","62437-Case Pack 6","Creative Kids Sand Art Asst-Case Pack 6","Case Pack 6",1.0000000000,True,
"","62438","Creative Kids Sand Art","Unit","62438-Case Pack 6","Creative Kids Sand Art-Case Pack 6","Case Pack 6",1.0000000000,True,
"","62832","My First Herb Kit-Basil","Unit","62832-Case Pack 6","My First Herb Kit-Basil-Case Pack 6","Case Pack 6",6.0000000000,True,
"","62848","MG KIDS: MY FIRST FLOWER GARDEN","Unit","62848-Case Pack 6","MG KIDS: MY FIRST FLOWER GARDEN-Case Pack 6","Case Pack 6",6.0000000000,True,
"","62850","MG KIDS: MY DINOSAUR GARDEN KIT","Unit","62850-Case Pack 6","Miracle Gro My First Dinosaur Garden Kit Age 6+-Case Pack 6","Case Pack 6",6.0000000000,True,
"","62853","Root Viewer","Unit","62853-Case Pack 6","Root Viewer-Case Pack 6","Case Pack 6",6.0000000000,True,
"","62863","DRAW & DISPLAY SUNCATCHER COLORING KIT","Unit","62863-Case Pack 6","DRAW & DISPLAY SUNCATCHER COLORING KIT-Case Pack 6","Case Pack 6",1.0000000000,True,
"","62864","SPARKLE ART","Unit","62864-Case Pack 12","SPARKLE ART-Case Pack 12","Case Pack 12",12.0000000000,True,
"","62891","PEEL N PLAY CU","Unit","62891-Case Pack 12, Inner 6 PDQ","PEEL N PLAY CU-Case Pack 12, Inner 6 PDQ","Case Pack 12, Inner 6 PDQ",1.0000000000,True,
"","62909","8 Pack of Zzand","Unit","62909-Case Pack 36","8 Pack of Zzand-Case Pack 36","Case Pack 36",36.0000000000,True,
"","62909","8 Pack of Zzand","Unit","62909-Case Pack 6","8 Pack of Zzand-Case Pack 6","Case Pack 6",1.0000000000,True,
"","62909","8 Pack of Zzand","Unit","62909-Case Pack 8","8 Pack of Zzand-Case Pack 8","Case Pack 8",8.0000000000,True,
"","62974","Stretch Sand Green","Unit","62974-Case Pack 6","Stretch Sand Green-Casepack 6","Case Pack 6",6.0000000000,True,
"","62995","Water Art Activity Pad -  Princesses","Unit","62995-Case Pack 24, Inner 6","Water Art Activity Pad -  Princesses-Case Pack 24, Inner 6","Case Pack 24, Inner 6",24.0000000000,True,
"","63007","KIDDY DOUGH 8 PK","Unit","63007-Case Pack 12","Kiddy Dough Pack - Modeling Dough Playset 8 Pack For Kids 3+-Casepack 12","Case Pack 12",12.0000000000,True,
"","63007","KIDDY DOUGH 8 PK","Unit","63007-Case Pack 6","Kiddy Dough Pack - Modeling Dough Playset 8 Pack For Kids 3+-Casepack 6","Case Pack 6",6.0000000000,True,
"","63143","Sense & Grow Sensory Fidget Maze","Unit","63143-Case Pack 6","Sense & Grow Sensory Fidget Maze-Casepack 6","Case Pack 6",1.0000000000,True,
"","63153","TRAIN SET","Unit","63153-Case Pack 6","Kiddy Dough My Magical Dough Train-Casepack 6","Case Pack 6",1.0000000000,True,
"","63203","CRYSTAL GROWING KIT","Unit","63203-Case Pack 6","CRYSTAL GROWING KIT-Case Pack 6","Case Pack 6",6.0000000000,True,
"","63207","2n1 Science Kit Ball Creature","Unit","63207-Case Pack 6","2n1 Science Kit Ball Creature-Case Pack 6","Case Pack 6",6.0000000000,True,
"","63218","ROCK AND  PLAY  SHAPE SORTER TOY","Unit","63218-Case Pack 6","Sense & Grow Sort & Stretch Balance Bin-Casepack 6","Case Pack 6",6.0000000000,True,
"","63224","MASTER CASTER DINOS","Unit","63224-Case Pack 6","MASTER CASTER DINOS-Case Pack 6","Case Pack 6",1.0000000000,True,
"","63225","MASTER CASTER BUGS","Unit","63225-Case Pack 6","MASTER CASTER BUGS-Case Pack 6","Case Pack 6",6.0000000000,True,
"","63256","ZZand Oh So Satisfying ASMR Power","Unit","63256-Case Pack 12, Inner 6","Zzand - Oh So Satisfying - ASMR Power-Casepack 12, Inner 6","Case Pack 12, Inner 6",12.0000000000,True,
"","63279-TGT","My First Herb Kit-Oregano","Unit","63279-TGT-Case Pack 6","My First Herb Kit-Oregano-Case Pack 6","Case Pack 6",6.0000000000,True,
"","63280-TGT","My First Herb Kit -Thyme","Unit","63280-TGT-Case Pack 6","My First Herb Kit -Thyme-Case Pack 6","Case Pack 6",6.0000000000,True,
"","63312","Moon Loom","Unit","63312-Case Pack 4","Moon Loom -Casepack 4","Case Pack 4",4.0000000000,True,
"","63494","6 Unicorn chalk","Unit","63494-Case Pack 12, Inner 4","6 Unicorn chalk-Case Pack 12, Inner 4","Case Pack 12, Inner 4",1.0000000000,True,
"","63495","4 Glitter Doughnut Chalk","Unit","63495-Case Pack 12, Inner 4","4 Glitter Doughnut Chalk-Case Pack 12, Inner 4","Case Pack 12, Inner 4",1.0000000000,True,
"","63635","Zzand Car Creations","Unit","63635-Case Pack 12","Zzand Car Creations-Case Pack 12","Case Pack 12",12.0000000000,True,
"","63638","MY 3D DOUGH SAFARI","Unit","63638-Case Pack 12","MY 3D DOUGH SAFARI-Case Pack 12","Case Pack 12",12.0000000000,True,
"","63640","DELUXE HAIR STUDIO","Unit","63640-Case Pack 12","Kiddy Dough Deluxe Hair Studio-Casepack 12","Case Pack 12",12.0000000000,True,
"","63641","ICE CREAM SWEET SHOP","Unit","63641-Case Pack 12","Kiddy Dough Ice Cream Sweetshop-Casepack 12","Case Pack 12",12.0000000000,True,
"","63644","SWEET CREATION","Unit","63644-Case Pack 20","Kiddy Dough Sweet Creations-Casepack 20","Case Pack 20",20.0000000000,True,
"","63644","SWEET CREATION","Unit","63644-Case Pack 36","SWEET CREATION-Case Pack 36","Case Pack 36",36.0000000000,True,
"","63645","MEGA SET","Unit","63645-Case Pack 12","MEGA SET-Case Pack 12","Case Pack 12",1.0000000000,True,
"","63645","MEGA SET","Unit","63645-Case Pack 6","4-1 MEGA SET-Casepack 6","Case Pack 6",6.0000000000,True,
"","63645","MEGA SET","Unit","63645-Case Pack 6 PDQ","4-1 MEGA SET-Casepack 6 PDQ","Case Pack 6 PDQ",6.0000000000,True,
"","63646","DINO DENTIST","Unit","63646-Case Pack 12","DINO DENTIST-Casepack 12","Case Pack 12",12.0000000000,True,
"","63648","BIG BUCKET","Unit","63648-Case Pack 12","BIG BUCKET-Case Pack 12","Case Pack 12",12.0000000000,True,
"","63742","Goozooka Squeezers","Unit","63742-Case Pack 24","Goozooka Squeezers-Casepack 24","Case Pack 24",1.0000000000,True,
"","63743","Goozooka Squeezers","Unit","63743-Case Pack 24","Goozooka Squeezers-Casepack 24","Case Pack 24",1.0000000000,True,
"","63744","Goozooka Squeezers","Unit","63744-Case Pack 24","-Casepack 24","Case Pack 24",1.0000000000,True,
"","63750","PYO PORECLAIN VASES","Unit","63750-Case Pack 6","PYO PORECLAIN VASES-Case Pack 6","Case Pack 6",6.0000000000,True,
"","63799","Scented Easter Chalk","Unit","63799-Case Pack 6 PDQ","Scented Easter Chalk-Case Pack 6 PDQ","Case Pack 6 PDQ",1.0000000000,True,
"","64023","PLAY-DOH MODELING CLAY 6OZ","Unit","64023-Case Pack 30","PLAY-DOH MODELING CLAY 6OZ-Case Pack 30","Case Pack 30",30.0000000000,True,
"","64038","Window Art","Unit","64038-Case Pack 6","Window Art-Case Pack 6","Case Pack 6",6.0000000000,True,
"","64317","So Yummy! Pom Pom Art","Case Pack 6","64317-Case Pack 6","So Yummy! Pom Pom Art-Casepack 6","Unit",6.0000000000,True,
"","64348","Rose Make Up Set","Unit","64348-Case Pack 10","Rose Make Up Set-Casepack 10","Case Pack 10",10.0000000000,True,
"","64348","Rose Make Up Set","Unit","64348-Case Pack 8","Rose Make Up Set-Case Pack 8","Case Pack 8",8.0000000000,True,
"","64349","Mermaid Make Up Set","Unit","64349-Case Pack 6","Mermaid Make Up Set-Case Pack 6","Case Pack 6",6.0000000000,True,
"","6446","License Nick PYO Rock","Unit","6446-Case Pack 6","License Nick PYO Rock -Case Pack 6","Case Pack 6",6.0000000000,True,
"","64497","6 in 1 Card Games","Unit","64497-Case Pack 6","6 in 1 Card Games-Case Pack 6","Case Pack 6",6.0000000000,True,
"","64515","Water Art -Alphabet","Unit","64515-Case Pack 24, Inner 6","Water Art -Alphabet-Case Pack 24, Inner 6","Case Pack 24, Inner 6",24.0000000000,True,
"","64516","Water Art -Make up","Unit","64516-Case Pack 24, Inner 6","Water Art -Make up-Case Pack 24, Inner 6","Case Pack 24, Inner 6",24.0000000000,True,
"","64575","4 CRYSTAL CHALK","Unit","64575-Case Pack 12, Inner 4","4 CRYSTAL CHALK-Case Pack 12, Inner 4","Case Pack 12, Inner 4",1.0000000000,True,
"","64652","CK READY SET CRAFT","Unit","64652-Case Pack 6","CK READY SET CRAFT-Case Pack 6","Case Pack 6",6.0000000000,True,
"","64678","CK SENSORY STICKER","Unit","64678-Case Pack 6","CK SENSORY STICKER-Case Pack 6","Case Pack 6",6.0000000000,True,
"","64805","Kiddy Dough Molded Containers-Bug","Unit","64805-DELETE 24, Inner 8 PDQ","Kiddy Dough Molded Containers-Bug-Case Pack 24, Inner 8 PDQ","Case Pack 24, Inner 8 PDQ",24.0000000000,True,
"","6480","BABY SHARK DOUGH SET","Unit","6480-Case Pack 6","BABY SHARK DOUGH SET-Case Pack 6","Case Pack 6",6.0000000000,True,
